<transcript:persontranscript
        xmlns:xsi='http://www.w3.org/2001/XMLSchema-instance'
        xmlns:transcript ='http://www.persontranscript.com'
        xsi:schemaLocation='http://www.persontranscript.com schemas/persontranscript.xsd'>

    <transcript:person>
        <transcript:firstname>Peter</transcript:firstname>
        <transcript:lastname>Ledberg</transcript:lastname>
        <transcript:ssn>8003456378</transcript:ssn>
        <transcript:program>
            <transcript:programName>Distributed systems</transcript:programName>
            <transcript:universityName>KTH</transcript:universityName>
            <transcript:course>
                <transcript:courseName>Webservices</transcript:courseName>
                <transcript:courseNumber>ID2208</transcript:courseNumber>
                <transcript:degree>5</transcript:degree>
                <transcript:startDate>2016-01-18</transcript:startDate>
                <transcript:finishedDate>2016-03-15</transcript:finishedDate>
            </transcript:course>
            <transcript:course>
                <transcript:courseName>Distributed Systems, Advanced Course</transcript:courseName>
                <transcript:courseNumber>ID2203</transcript:courseNumber>
                <transcript:degree>4</transcript:degree>
                <transcript:startDate>2016-01-18</transcript:startDate>
                <transcript:finishedDate>2016-03-15</transcript:finishedDate>
            </transcript:course>
            <transcript:startDate>2015-08-30</transcript:startDate>
            <transcript:finishDate>2017-06-01</transcript:finishDate>
        </transcript:program>
    </transcript:person>


</transcript:persontranscript>